name,subtype,category,level,effect_family,delivery,application_time,duration,effect,description,ingredient_1_id,process_1,ingredient_2_id,process_2,ingredient_3_id,process_3,ingredient_4_id,process_4,hex_code
Horac's Essence,Tincture,Tonics,1,Confer Skill,Ingested,Instant,1 hour,"""Bestow Strength Skill for 1 hour""",Horac’s Essence empowers the imbiber with Strength for up to five minutes. This has no effect if the imbiber already has Strength.,13,Extraction,,,,,,,8A A4 87 A7
Hyacinth Nectar,Vial,Vial,1,Component,None,None,None,Component,Used in other recipes,90,Dissolution,,,,,,,B3 75 7F FA
Hydrogen Atheleck,Vial,Vial,1,Component,None,None,None,Component,Used in other recipes,3,Dissolution,,,,,,,B5 51 45 FA
Improve Resistance Tincture,Tincture,Tonics,1,Defensive,Ingested,Instant,1 hour,See Description,When ingested the drinker may resist one additional elemental attack when an elemental shield is cast on them,94,Calcination,,,,,,,3D C6 25 82
Improve Toxin Resistance Tincture,Tincture,Tonics,1,Utility,Ingested,Instant,1 hour,See Description,This tincture will cause the next use of Resist Toxin to cost 1 AP less than normal to a minimum of 1ap (i.e resist level 1 or 2 effect for 1 AP  level 3 effect for 2ap).,111,Extraction,,,,,,,3D B5 F9 F0
Inert Alchemical Substance,Inert,Inert,1,Inert,None,None,None,None,Concentration of flint creates an innert alchemical substance.,45,Concentration,,,,,,,0E 4C 28 --
Inert Alchemical Substance 2,Inert,Inert,1,Inert,None,None,None,None,Concentration of Fly is only useful in journeyman recipies involving diseases/sickness,46,Concentration,,,,,,,0E 56 C4 C8
Inert Alchemical Substance 3,Inert,Inert,1,Inert,None,None,None,None,Extraction of flint creates an innert alchemical substance.,45,Extraction,,,,,,,0E D6 A8 63
Inert Alchemical Substance 5,Inert,Inert,1,Inert,None,None,None,None,There is no alchemical substance created.,111,Dissolution,,,,,,,0E E7 07 E6
Irritation Salve,Salve,Liniments,1,Confer Status,Applied,1 minute,1 minute,"""RP Itchiness toxin lv 1 1 minute""",This salve will cause the target to RP Itchiness for 1 minute,46,Extraction,,,,,,,0E 25 CE 8C
Lightning Protection Salve,Salve,Liniments,1,Damage Reduction,Applied,1 minute,1 hour,"Bestow "" Reduce next lightning damage by 3"" call ""Reduced""","Once spread onto a person or creature they may reduce the next lightning damage which hits them by 3 points (salve is used regardless of total damage i.e 3 damage would still use up the salve).
 The Salve lasts until used or the end of the next reset",33,Extraction,,,,,,,35 3F D7 D6
Mend Limb Tincture,Tincture,Tonics,1,Curing,Ingested,Instant,Instant,"""Cure all maims  2 body toxin""",This strange decoction removes all Maim effects from the imbiber. The effect has an onset time of one minutes  at the end of which the imbiber is also dealt two points of Body Toxin damage.,64,Extraction,,,,,,,A0 B5 4A 7E
Mercury,Vial,Vial,1,Component,None,None,None,Component,Used to break down alchemy substances for research,17,Calcination,,,,,,,EF 18 8E BE
Minor Harming Oil,Oil,Coatings,1,Imbue,Applied,1 minute,10 minutes,"Bestow ""Body on next strike""",The target of a blade coated with this substance takes the damage directly to their body .(if not used within 1 hour the effect wears off),103,Dissolution,,,,,,,EF E7 6B --
Multiplication Salve,Salve,Liniments,1,Confer Status,Applied,1 minute,1 hour,"Bestow Malady ""Next leveled effect to strike target has level increased by 1""",After applying this salve  the next leveled effect to strike the target has it's level increased by 1 to a maximum of 3. Effect lasts until1 hour.,94,Extraction,,,,,,,5E E9 0B 14
Nauseating Tincture,Tincture,Tonics,1,Confer Status,Ingested,Instant,5 minutes,"""RP Nausea toxin lv1 5 minutes""","The imbiber of this tincture immediately suffers ""RP Nausea Toxin 1 minute """,46,Dissolution,,,,,,,5E 53 9B B4
Newt Acid,Vial,Vial,1,Component,None,None,None,Component,"Identifies all ""dummy"" component slots in a recipe.",28,Calcination,,,,,,,5E 73 4A 13
Palliative Tincture,Tincture,Tonics,1,Healing,Ingested,Instant,Instant,"""Heal 1 to maimed target""",if imbiber is suffering from a maimed limb  they heal 1hp  otherwise there is no effect,78,Calcination,,,,,,,5E 73 EE FA
Paralysis Poison,Tincture,Tonics,1,Confer Status,Ingested,Instant,10 minutes,"""Paralysis toxin lv 1 10 minutes""",Causes the imbiber to be affected by a Level 1 Paralysis Toxin effect.,15,Calcination,,,,,,,5E 25 A8 1B
Persil Liquid,Vial,Vial,1,Component,None,None,None,Component,Used to break down alchemy substances for research,3,Calcination,,,,,,,48 0F C4 6E
Poison Neutralization Powder,Powder,Particulates,1,Utility,Applied,1 minute,Instant,"""Remove lv 1 toxin  poison or disease from plate of food or single drink""",A fine green powder when sprinkled upon foods or mixed into a beverage  will neutralize toxins per the Purify Food and Drink spell.,68,Calcination,,,,,,,04 E9 0B 78
Protective Salve,Salve,Liniments,1,Damage Reduction,Applied,1 minute,1 hour,"""Bestow reduce next strike by 1""","This salve protects the user against one point of damage from the next weapon to strike them call ""Reduced"" and take 1 less damage to a minumum of 0",14,Extraction,,,,,,,5F E7 51 0E
Putrifying Salve,Salve,Liniments,1,Confer Status,Applied,1 minute,1 hour,"""Disease Toxin lv 1 after 1 minute""","This salve when applied to a living target will cause a level 1 disease after 1 minutes ""Disease Toxin""",19,Dissolution,,,,,,,B0 20 A4 25
Radix Liquid,Vial,Vial,1,Component,None,None,None,Component,Used in other recipes,30,Dissolution,,,,,,,9B FB 97 DE
Repair Glue,Salve,Liniments,1,Utility,Applied,1 minute,Instant,See Description,This thick glue repairs a Shattered item. Requires three minutes to apply.,30,Extraction,,,,,,,AA 18 F4 BE
Restorative Salve,Salve,Liniments,1,Curing,Applied,15 seconds,Instant,"""Cure Maim""",When applied to a maimed limb the limb becomes usable again after one minute. Takes ten seconds to apply.,24,Calcination,,,,,,,49 46 9A 1B
Sleeping Tincture,Tincture,Tonics,1,Confer Status,Ingested,Instant,5 minutes,"""Sleep lv 1 five minutes""",Instantly causes the imbiber to be affected by a Level 1 Sleep Toxin effect for five minutes.,1,Extraction,,,,,,,1D 20 9A AA
Slowing Salve,Salve,Liniments,1,Confer Status,Applied,1 minute,1 minute,"""Slow toxin lv 1 1 minute""",When applied to living creature this causes the Slow effect for one minute  takes one minute to apply.,72,Calcination,,,,,,,BA 96 39 B4
Smelling Salts,Powder,Particulates,1,Curing,Applied,15 seconds,Instant,"""Cure Sleep or Unconsciousness""",Smelling Salts allow the user to rouse a sleeping or unconscious person  removing the Sleep effect.,86,Extraction,,,,,,,12 20 51 --
Tincture of The Impossible,Tincture,Tonics,1,Confer Status,Ingested,Instant,5 minutes,"""RP Hallucinations five minutes""",Causes the imbiber to RP having hallucinations for 5 minutes,50,Calcination,,,,,,,00 BB A0 1E
Tincture of Vulnerability,Tincture,Tonics,1,Confer Status,Ingested,Instant,5 minutes,"""RP emotional instability toxin lv1 5 minutes""",Causes the imbiber to RP emotional instability for 5 minutes.,50,Extraction,,,,,,,00 DD A7 32
Toxic Tincture,Tincture,Tonics,1,Confer Status,Ingested,Instant,5 minutes,"""RP Nausea toxin lv1""",When imbibed the drinker immidately suffers the nasuea toxin effect for 5 minutes.,3,Extraction,,,,,,,CE 28 CE A0
Tranquil Mind Tincture,Tincture,Tonics,1,Curing,Ingested,Instant,Instant,"""Tranquil Mind Toxin""",Removes Berserk  any RP (emotion) and induces RP (calm) 10 second onset,10,Extraction,,,,,,,B3 B5 9F B4
Wayfinding Tincture,Tincture,Tonics,1,Confer Skill,Ingested,Instant,1 hour,See Description,Gain one use of the Troubleshooting Skill to be used within one hour (You do not need to have the skill  or spend AP),79,Concentration,,,,,,,CE 40 C1 1C
Weakening Oil,Oil,Coatings,1,Confer Status,Applied,1 minute,10 minutes,"Bestow Malady ""After 5 minutes next strike on this item is a shatter""",When spread onto metal object this oil weakens the metal. After 5 minutes the next blow that strikes the object is treated as a “Shatter”,83,Dissolution,,,,,,,F7 E7 03 --